{
  "schemaVersion": "2.0.0",
  "projectId": "learning-video-architektur",
  "slug": "learning-video-architektur",
  "title": "Architektur · Coming soon",
  "contentPackageId": "learning-videos-coming-soon-20261009",
  "timebase": {
    "numerator": 30,
    "denominator": 1
  },
  "canvas": {
    "width": 640,
    "height": 360,
    "aspectRatio": "16:9"
  },
  "durationFrames": 90,
  "tracks": [
    {
      "id": "graphic",
      "kind": "graphics",
      "enabled": true,
      "layers": [
        {
          "id": "coming-soon",
          "kind": "image",
          "enabled": true,
          "range": {
            "startFrame": 0,
            "durationFrames": 90
          },
          "assetRefId": "art",
          "fit": "contain"
        }
      ]
    }
  ],
  "assets": [
    {
      "id": "art",
      "kind": "image",
      "sourceType": "local-file",
      "reference": "public/learning/videos/architektur.svg",
      "sha256": "059e3e6bb214ae6a86fa31815fc2d19182a8c80b1d0202a546e017d7598afb83",
      "mimeType": "image/svg+xml",
      "width": 640,
      "height": 360
    }
  ],
  "transitions": [],
  "renderRecipe": {
    "templateId": "learning-coming-soon",
    "templateVersion": "1.0.0",
    "rendererProfile": "original-svg",
    "brandTokenSource": "public/branding/asset-pack/meta/social-render-tokens.json",
    "brandTextMode": "deterministic",
    "networkPolicy": "offline",
    "publishReady": false
  },
  "source": {
    "type": "content-package",
    "reference": "src/features/learning/LearningComingSoonGraphic.tsx"
  },
  "disclosure": {
    "defaultDisclaimer": "Coming soon · noch kein Lernvideo veröffentlicht",
    "requireAtProjectEdges": true
  },
  "metadata": {
    "draftOnly": true,
    "videoRendered": false,
    "rights": "SELF_AUTHORED_ORIGINAL",
    "sourceSha": "6620033b6ea1b5a9c379a937fbc21455102ae6fa"
  }
}
