{
  "schemaVersion": "2.0.0",
  "projectId": "chart-donchian",
  "slug": "donchian",
  "title": "Donchian-Kanal",
  "contentPackageId": "chart-learning-20261009",
  "timebase": {
    "numerator": 30,
    "denominator": 1
  },
  "canvas": {
    "width": 1200,
    "height": 675,
    "aspectRatio": "16:9"
  },
  "durationFrames": 360,
  "tracks": [
    {
      "id": "graphic",
      "kind": "graphics",
      "enabled": true,
      "layers": [
        {
          "id": "chart",
          "kind": "image",
          "enabled": true,
          "range": {
            "startFrame": 0,
            "durationFrames": 360
          },
          "assetRefId": "chart-svg",
          "fit": "contain"
        }
      ]
    }
  ],
  "assets": [
    {
      "id": "chart-svg",
      "kind": "image",
      "sourceType": "local-file",
      "reference": "public/learning/charts/donchian.svg",
      "sha256": "04bf58f19c86437ca62d167f4f2e992c27f49b26fd7ad0652f2d23e2c9a23c00",
      "mimeType": "image/svg+xml",
      "width": 1200,
      "height": 675
    }
  ],
  "transitions": [],
  "renderRecipe": {
    "templateId": "chart-learning-svg",
    "templateVersion": "1.0.0",
    "rendererProfile": "chart-learning-svg-v1",
    "brandTokenSource": "public/branding/asset-pack/meta/social-render-tokens.json",
    "brandTextMode": "deterministic",
    "networkPolicy": "offline",
    "publishReady": false
  },
  "source": {
    "type": "content-package",
    "reference": "src/data/chartLearning.ts"
  },
  "disclosure": {
    "defaultDisclaimer": "Synthetisches Lernbeispiel · keine Live-Kurse · keine Anlageberatung",
    "requireAtProjectEdges": true
  },
  "metadata": {
    "draftOnly": true,
    "synthetic": true,
    "sourceSha": "6620033b6ea1b5a9c379a937fbc21455102ae6fa",
    "outputStatus": "SVG_RENDERED_MEDIA_PROJECT_DRAFT",
    "videoRendered": false
  }
}
