{
  "schemaVersion": "2.0.0",
  "projectId": "chart-head-shoulders",
  "slug": "head-shoulders",
  "title": "Schulter–Kopf–Schulter",
  "contentPackageId": "chart-learning-20261009",
  "timebase": {
    "numerator": 30,
    "denominator": 1
  },
  "canvas": {
    "width": 1200,
    "height": 675,
    "aspectRatio": "16:9"
  },
  "durationFrames": 360,
  "tracks": [
    {
      "id": "graphic",
      "kind": "graphics",
      "enabled": true,
      "layers": [
        {
          "id": "chart",
          "kind": "image",
          "enabled": true,
          "range": {
            "startFrame": 0,
            "durationFrames": 360
          },
          "assetRefId": "chart-svg",
          "fit": "contain"
        }
      ]
    }
  ],
  "assets": [
    {
      "id": "chart-svg",
      "kind": "image",
      "sourceType": "local-file",
      "reference": "public/learning/charts/head-shoulders.svg",
      "sha256": "19f1efc123011e4a14eb8a494aa71523026221b35f06d5a25ca75c77335c5bb6",
      "mimeType": "image/svg+xml",
      "width": 1200,
      "height": 675
    }
  ],
  "transitions": [],
  "renderRecipe": {
    "templateId": "chart-learning-svg",
    "templateVersion": "1.0.0",
    "rendererProfile": "chart-learning-svg-v1",
    "brandTokenSource": "public/branding/asset-pack/meta/social-render-tokens.json",
    "brandTextMode": "deterministic",
    "networkPolicy": "offline",
    "publishReady": false
  },
  "source": {
    "type": "content-package",
    "reference": "src/data/chartLearning.ts"
  },
  "disclosure": {
    "defaultDisclaimer": "Synthetisches Lernbeispiel · keine Live-Kurse · keine Anlageberatung",
    "requireAtProjectEdges": true
  },
  "metadata": {
    "draftOnly": true,
    "synthetic": true,
    "sourceSha": "75b0bae05a5c862e87274adf28a5e4d079c5a87a",
    "outputStatus": "SVG_RENDERED_MEDIA_PROJECT_DRAFT",
    "videoRendered": false
  }
}
